{
  "schema_version": "1.0.0",
  "authority": "INTERACTION_REUSE_CONSUMER_SOURCE",
  "subject": "Mathematics",
  "implementation_source_ref": "Mathematics/interactions/linear-equations-two-variables.local.json",
  "consumer_ref": "Q-MAT-LEQ-04-1A-TEST-PAIRS",
  "slice_ref": "pair-testing-question",
  "mode": "R1",
  "relation": "CONSUMES"
}
